{
  "$schema": "docs/validation/unity-compile-result.schema.json",
  "schema": "xr-foundry.unity_compile_result.v1",
  "profile_id": "unity-6000.3-interaction-unity-windows-editor",
  "commit_sha": "5c948b13e166de4b1882e2c0d5b4a857670ffdff",
  "unity_version": "6000.3.19f1",
  "build_target": "WindowsEditor",
  "graphics_api": "Null",
  "scripting_backend": "Mono",
  "architecture": "x86_64",
  "manifest_sha256": "ed2acb0edb22c7777d4a13eb0a164b627b4612c18b63704ef295a8a5e8591d66",
  "lock_sha256": "422b102beec95baeeef3c0bf413c0a77f50ace58c3155fe5ffa44f2858872af6",
  "batchmode": true,
  "result": "pass",
  "error_count": 0,
  "warning_count": 0,
  "started_at": "2026-07-16T21:52:53Z",
  "completed_at": "2026-07-16T21:52:54Z"
}
