{
  "$schema": "docs/validation/unity-compile-result.schema.json",
  "schema": "xr-foundry.unity_compile_result.v1",
  "profile_id": "unity-6000.3-inventory-authoring-windows-editor",
  "commit_sha": "a25bbc7c9855ae4f094a58e43d8ab5ffdf37a7bf",
  "unity_version": "6000.3.19f1",
  "build_target": "WindowsEditor",
  "graphics_api": "Null",
  "scripting_backend": "Mono",
  "architecture": "x86_64",
  "manifest_sha256": "890cf96dac387ceb79ae8191bdd0dd517354361f3c3801a095b35d3a1c6914cc",
  "lock_sha256": "4e230a4c4a00809cedacfe836a8d25c0ca0c558da4142cfeb5963fd92b648acb",
  "batchmode": true,
  "result": "pass",
  "error_count": 0,
  "warning_count": 0,
  "started_at": "2026-07-15T16:15:44.8787808Z",
  "completed_at": "2026-07-15T16:15:57.8620259Z"
}
