{
  "$schema": "docs/validation/unity-compile-result.schema.json",
  "schema": "xr-foundry.unity_compile_result.v1",
  "profile_id": "unity-6000.3-inventory-xr-ugui-openxr-windows-editor",
  "commit_sha": "a25bbc7c9855ae4f094a58e43d8ab5ffdf37a7bf",
  "unity_version": "6000.3.19f1",
  "build_target": "WindowsEditor",
  "graphics_api": "Null",
  "scripting_backend": "Mono",
  "architecture": "x86_64",
  "manifest_sha256": "82906b45c0bc4c8161513c8da9b4ac8764ff575caad822e08364279e290831e4",
  "lock_sha256": "30e2b1846d584e41df3d6a039822ce6eb5768d3c913bad54e92d2c6789064eca",
  "batchmode": true,
  "result": "pass",
  "error_count": 0,
  "warning_count": 0,
  "started_at": "2026-07-15T16:22:27.5711657Z",
  "completed_at": "2026-07-15T16:22:46.5515142Z"
}
