{
  "$schema": "docs/validation/unity-compile-result.schema.json",
  "schema": "xr-foundry.unity_compile_result.v1",
  "profile_id": "unity-6000.3-inventory-ugui-non-xr-windows-editor",
  "commit_sha": "a25bbc7c9855ae4f094a58e43d8ab5ffdf37a7bf",
  "unity_version": "6000.3.19f1",
  "build_target": "WindowsEditor",
  "graphics_api": "Null",
  "scripting_backend": "Mono",
  "architecture": "x86_64",
  "manifest_sha256": "38484a7c67bd30efb03cc7d1b56ff94aa07aa172ce9463ff8661f0c8d0b5cb89",
  "lock_sha256": "3126be75e3120f1513505fbc8e15637c2f863b6d80525bde3c3fbb7f21c2c102",
  "batchmode": true,
  "result": "pass",
  "error_count": 0,
  "warning_count": 0,
  "started_at": "2026-07-15T16:16:41.7771726Z",
  "completed_at": "2026-07-15T16:17:00.2498726Z"
}
